{
  "protocol_version": "codeattest.v0",
  "disclosure_policy_id": "sha256:1979f6602994f40988f9f8e0b38b6c1cdb7a61478daabbfb71fcf65298d7275c",
  "created_at": "2026-07-06T00:00:00Z",
  "review_scope_ref": "sha256:4fbf6826606062d0ff795c1df1a38dac5353b52a7b57c669df9d45cbad73bce2",
  "coverage_mode": "metadata_only",
  "include_metadata": true,
  "include_dependency_information": true,
  "include_scanner_findings": false,
  "evidence_categories": [
    {
      "category": "metadata",
      "included": true,
      "source_derived_class": "retained_review_artifact",
      "retention_handling": "retained review metadata"
    },
    {
      "category": "dependencies",
      "included": true,
      "source_derived_class": "retained_review_artifact",
      "retention_handling": "retained dependency metadata"
    },
    {
      "category": "scanner_findings",
      "included": false,
      "source_derived_class": "never_collected",
      "retention_handling": "not included by this metadata-only fixture"
    },
    {
      "category": "raw_snippets",
      "included": false,
      "source_derived_class": "never_collected",
      "retention_handling": "Raw Snippets are not collected"
    },
    {
      "category": "targeted_files",
      "included": false,
      "source_derived_class": "never_collected",
      "retention_handling": "targeted files are not collected"
    },
    {
      "category": "derived_artifacts",
      "included": true,
      "source_derived_class": "retained_review_artifact",
      "retention_handling": "retained derived policy metadata"
    },
    {
      "category": "never_collected_items",
      "included": false,
      "source_derived_class": "never_collected",
      "retention_handling": "Raw Snippets, targeted files, and complete repository archives are not collected",
      "limitation": "Final downstream review materials must state snippets were not provided."
    }
  ],
  "snippet_policy": {
    "allow_raw_snippets": false,
    "max_snippet_chars": 0,
    "context_lines": 0,
    "redaction_profile": "not_configured",
    "raw_snippet_default_class": "transient_source_derived",
    "selection_behavior": "none",
    "selected_files_or_areas": []
  },
  "redaction_policy": {
    "enabled": false,
    "profile": "not_configured",
    "configuration_version": "not_configured",
    "limitation": "No redaction is applied because Raw Snippets and targeted files are not collected."
  },
  "retention_policy": {
    "raw_snippet_class": "transient_source_derived",
    "targeted_file_class": "transient_source_derived",
    "retain_source_opt_in": false,
    "retention_period": "not_applicable"
  },
  "warnings": [
    "Metadata-only mode may mean expert confidence may be lower.",
    "Final downstream review materials must state snippets were not provided."
  ],
  "limitations": [
    "No Raw Snippets or targeted files are collected.",
    "No complete repository archive is collected."
  ],
  "synthetic_fixture_markers": [
    "SYNTHETIC_DEMO_DATA",
    "NOT_CUSTOMER_SOURCE"
  ]
}
